{
  "provider": "c1v",
  "fetched_at": "2026-05-20T00:00:00.000Z",
  "source": "c1vhosting.it/store/linux-vps-ssd",
  "manual": true,
  "instances": [
    {
      "id": "venice",
      "name": "VENICE",
      "vcpu": 2,
      "ram_gb": 2,
      "disk_gb": 40,
      "disk_type": "ssd",
      "price_hourly": 0.00829,
      "price_monthly": 6.05,
      "currency": "EUR",
      "architecture": "x86",
      "location": "it-rom",
      "category": "standard"
    },
    {
      "id": "naples",
      "name": "NAPLES",
      "vcpu": 2,
      "ram_gb": 4,
      "disk_gb": 60,
      "disk_type": "ssd",
      "price_hourly": 0.00934,
      "price_monthly": 6.82,
      "currency": "EUR",
      "architecture": "x86",
      "location": "it-rom",
      "category": "standard"
    },
    {
      "id": "piacenza",
      "name": "PIACENZA",
      "vcpu": 4,
      "ram_gb": 8,
      "disk_gb": 100,
      "disk_type": "ssd",
      "price_hourly": 0.01130,
      "price_monthly": 8.25,
      "currency": "EUR",
      "architecture": "x86",
      "location": "it-rom",
      "category": "standard"
    },
    {
      "id": "verona",
      "name": "VERONA",
      "vcpu": 4,
      "ram_gb": 16,
      "disk_gb": 150,
      "disk_type": "ssd",
      "price_hourly": 0.01432,
      "price_monthly": 10.45,
      "currency": "EUR",
      "architecture": "x86",
      "location": "it-rom",
      "category": "standard"
    },
    {
      "id": "trieste",
      "name": "TRIESTE",
      "vcpu": 8,
      "ram_gb": 20,
      "disk_gb": 200,
      "disk_type": "ssd",
      "price_hourly": 0.02411,
      "price_monthly": 17.60,
      "currency": "EUR",
      "architecture": "x86",
      "location": "it-rom",
      "category": "standard"
    }
  ],
  "egress": {
    "free_tb": 20,
    "bandwidth_gbps": 1,
    "notes": "20TB @ 1Gbps bandwidth included"
  },
  "notes": "RAID 10 SSD storage, DDR4 ECC RAM. Datacenter in Pomezia, Rome. IPv4 + IPv6 included."
}
