{
  "provider": "contabo",
  "fetched_at": "2026-10-12T00:00:00.000Z",
  "source": "contabo.com/en/vps + /en/vps-performance (1-month term, excl. VAT; the large card price is the 24-month rate, 20% lower)",
  "manual": true,
  "instances": [
    {
      "id": "cloud-vps-core-4",
      "name": "Cloud VPS 4",
      "vcpu": 4,
      "ram_gb": 8,
      "disk_gb": 100,
      "price_monthly": 5.5,
      "disk_type": "ssd",
      "price_hourly": 0.0075,
      "currency": "EUR",
      "architecture": "x86",
      "location": "eu"
    },
    {
      "id": "cloud-vps-core-6",
      "name": "Cloud VPS 6",
      "vcpu": 6,
      "ram_gb": 12,
      "disk_gb": 200,
      "price_monthly": 7.5,
      "disk_type": "ssd",
      "price_hourly": 0.0103,
      "currency": "EUR",
      "architecture": "x86",
      "location": "eu"
    },
    {
      "id": "cloud-vps-core-8",
      "name": "Cloud VPS 8",
      "vcpu": 8,
      "ram_gb": 24,
      "disk_gb": 300,
      "price_monthly": 14,
      "disk_type": "ssd",
      "price_hourly": 0.0192,
      "currency": "EUR",
      "architecture": "x86",
      "location": "eu"
    },
    {
      "id": "cloud-vps-core-12",
      "name": "Cloud VPS 12",
      "vcpu": 12,
      "ram_gb": 48,
      "disk_gb": 400,
      "price_monthly": 25,
      "disk_type": "ssd",
      "price_hourly": 0.0342,
      "currency": "EUR",
      "architecture": "x86",
      "location": "eu"
    },
    {
      "id": "cloud-vps-core-16",
      "name": "Cloud VPS 16",
      "vcpu": 16,
      "ram_gb": 64,
      "disk_gb": 500,
      "price_monthly": 37,
      "disk_type": "ssd",
      "price_hourly": 0.0507,
      "currency": "EUR",
      "architecture": "x86",
      "location": "eu"
    },
    {
      "id": "cloud-vps-core-18",
      "name": "Cloud VPS 18",
      "vcpu": 18,
      "ram_gb": 96,
      "disk_gb": 600,
      "price_monthly": 49,
      "disk_type": "ssd",
      "price_hourly": 0.0671,
      "currency": "EUR",
      "architecture": "x86",
      "location": "eu"
    },
    {
      "id": "cloud-vps-plus-4",
      "name": "Cloud VPS Plus 4",
      "vcpu": 4,
      "ram_gb": 8,
      "disk_gb": 150,
      "price_monthly": 13.5,
      "disk_type": "nvme",
      "price_hourly": 0.0185,
      "currency": "EUR",
      "architecture": "x86",
      "location": "eu"
    },
    {
      "id": "cloud-vps-plus-6",
      "name": "Cloud VPS Plus 6",
      "vcpu": 6,
      "ram_gb": 12,
      "disk_gb": 300,
      "price_monthly": 19,
      "disk_type": "nvme",
      "price_hourly": 0.026,
      "currency": "EUR",
      "architecture": "x86",
      "location": "eu"
    },
    {
      "id": "cloud-vps-plus-8",
      "name": "Cloud VPS Plus 8",
      "vcpu": 8,
      "ram_gb": 24,
      "disk_gb": 450,
      "price_monthly": 35,
      "disk_type": "nvme",
      "price_hourly": 0.0479,
      "currency": "EUR",
      "architecture": "x86",
      "location": "eu"
    },
    {
      "id": "cloud-vps-plus-12",
      "name": "Cloud VPS Plus 12",
      "vcpu": 12,
      "ram_gb": 48,
      "disk_gb": 600,
      "price_monthly": 59,
      "disk_type": "nvme",
      "price_hourly": 0.0808,
      "currency": "EUR",
      "architecture": "x86",
      "location": "eu"
    },
    {
      "id": "cloud-vps-plus-16",
      "name": "Cloud VPS Plus 16",
      "vcpu": 16,
      "ram_gb": 64,
      "disk_gb": 750,
      "price_monthly": 79,
      "disk_type": "nvme",
      "price_hourly": 0.1082,
      "currency": "EUR",
      "architecture": "x86",
      "location": "eu"
    },
    {
      "id": "cloud-vps-plus-18",
      "name": "Cloud VPS Plus 18",
      "vcpu": 18,
      "ram_gb": 96,
      "disk_gb": 900,
      "price_monthly": 99,
      "disk_type": "nvme",
      "price_hourly": 0.1356,
      "currency": "EUR",
      "architecture": "x86",
      "location": "eu"
    }
  ],
  "load_balancer": {
    "price_monthly": 0
  },
  "block_storage": {
    "price_per_gb_monthly": 0.01
  },
  "egress": {
    "free_tb": "unlimited",
    "price_per_gb": 0,
    "notes": "Unlimited traffic, fair usage policy with throttling; no per-GB overage price."
  },
  "object_storage": {
    "price_per_gb_monthly": 0.01,
    "allocation_block_gb": 250,
    "type": "S3-compatible",
    "notes": "€2.49/month per 250GB block (~€0.01/GB). Unlimited traffic included."
  },
  "source_url": "https://contabo.com/en/vps/"
}
