{
  "provider": "exoscale",
  "fetched_at": "2026-05-20T00:00:00.000Z",
  "source": "static",
  "manual": true,
  "control_plane_cost": 40.15,
  "instances": [
    {
      "id": "cpu.extra-large",
      "name": "CPU Extra-Large",
      "vcpu": 8,
      "ram_gb": 16,
      "disk_gb": 10,
      "disk_type": "ssd",
      "price_hourly": 0.23333,
      "price_monthly": 170.33,
      "currency": "EUR",
      "architecture": "x86",
      "location": "eu",
      "category": "compute"
    },
    {
      "id": "cpu.huge",
      "name": "CPU Huge",
      "vcpu": 16,
      "ram_gb": 32,
      "disk_gb": 10,
      "disk_type": "ssd",
      "price_hourly": 0.46666,
      "price_monthly": 340.66,
      "currency": "EUR",
      "architecture": "x86",
      "location": "eu",
      "category": "compute"
    },
    {
      "id": "cpu.mega",
      "name": "CPU Mega",
      "vcpu": 32,
      "ram_gb": 64,
      "disk_gb": 10,
      "disk_type": "ssd",
      "price_hourly": 0.93333,
      "price_monthly": 681.33,
      "currency": "EUR",
      "architecture": "x86",
      "location": "eu",
      "category": "compute"
    },
    {
      "id": "cpu.titan",
      "name": "CPU Titan",
      "vcpu": 40,
      "ram_gb": 128,
      "disk_gb": 10,
      "disk_type": "ssd",
      "price_hourly": 1.86667,
      "price_monthly": 1362.67,
      "currency": "EUR",
      "architecture": "x86",
      "location": "eu",
      "category": "compute"
    },
    {
      "id": "memory.extra-large",
      "name": "Memory Extra-Large",
      "vcpu": 2,
      "ram_gb": 16,
      "disk_gb": 10,
      "disk_type": "ssd",
      "price_hourly": 0.14,
      "price_monthly": 102.2,
      "currency": "EUR",
      "architecture": "x86",
      "location": "eu",
      "category": "memory"
    },
    {
      "id": "memory.huge",
      "name": "Memory Huge",
      "vcpu": 4,
      "ram_gb": 32,
      "disk_gb": 10,
      "disk_type": "ssd",
      "price_hourly": 0.28,
      "price_monthly": 204.4,
      "currency": "EUR",
      "architecture": "x86",
      "location": "eu",
      "category": "memory"
    },
    {
      "id": "memory.mega",
      "name": "Memory Mega",
      "vcpu": 8,
      "ram_gb": 64,
      "disk_gb": 10,
      "disk_type": "ssd",
      "price_hourly": 0.56,
      "price_monthly": 408.8,
      "currency": "EUR",
      "architecture": "x86",
      "location": "eu",
      "category": "memory"
    },
    {
      "id": "memory.titan",
      "name": "Memory Titan",
      "vcpu": 12,
      "ram_gb": 128,
      "disk_gb": 10,
      "disk_type": "ssd",
      "price_hourly": 1.12,
      "price_monthly": 817.6,
      "currency": "EUR",
      "architecture": "x86",
      "location": "eu",
      "category": "memory"
    },
    {
      "id": "standard.micro",
      "name": "Micro",
      "vcpu": 1,
      "ram_gb": 0.5,
      "disk_gb": 10,
      "disk_type": "ssd",
      "price_hourly": 0.00729,
      "price_monthly": 5.32,
      "currency": "EUR",
      "architecture": "x86",
      "location": "eu",
      "category": "standard"
    },
    {
      "id": "standard.tiny",
      "name": "Tiny",
      "vcpu": 1,
      "ram_gb": 1,
      "disk_gb": 10,
      "disk_type": "ssd",
      "price_hourly": 0.01458,
      "price_monthly": 10.64,
      "currency": "EUR",
      "architecture": "x86",
      "location": "eu",
      "category": "standard"
    },
    {
      "id": "standard.small",
      "name": "Small",
      "vcpu": 2,
      "ram_gb": 2,
      "disk_gb": 10,
      "disk_type": "ssd",
      "price_hourly": 0.02333,
      "price_monthly": 17.03,
      "currency": "EUR",
      "architecture": "x86",
      "location": "eu",
      "category": "standard"
    },
    {
      "id": "standard.medium",
      "name": "Medium",
      "vcpu": 2,
      "ram_gb": 4,
      "disk_gb": 10,
      "disk_type": "ssd",
      "price_hourly": 0.04666,
      "price_monthly": 34.06,
      "currency": "EUR",
      "architecture": "x86",
      "location": "eu",
      "category": "standard"
    },
    {
      "id": "standard.large",
      "name": "Large",
      "vcpu": 4,
      "ram_gb": 8,
      "disk_gb": 10,
      "disk_type": "ssd",
      "price_hourly": 0.09333,
      "price_monthly": 68.13,
      "currency": "EUR",
      "architecture": "x86",
      "location": "eu",
      "category": "standard"
    },
    {
      "id": "standard.extra-large",
      "name": "Extra-Large",
      "vcpu": 4,
      "ram_gb": 16,
      "disk_gb": 10,
      "disk_type": "ssd",
      "price_hourly": 0.18667,
      "price_monthly": 136.27,
      "currency": "EUR",
      "architecture": "x86",
      "location": "eu",
      "category": "standard"
    },
    {
      "id": "standard.huge",
      "name": "Huge",
      "vcpu": 8,
      "ram_gb": 32,
      "disk_gb": 10,
      "disk_type": "ssd",
      "price_hourly": 0.37334,
      "price_monthly": 272.54,
      "currency": "EUR",
      "architecture": "x86",
      "location": "eu",
      "category": "standard"
    },
    {
      "id": "standard.mega",
      "name": "Mega",
      "vcpu": 12,
      "ram_gb": 64,
      "disk_gb": 10,
      "disk_type": "ssd",
      "price_hourly": 0.74667,
      "price_monthly": 545.07,
      "currency": "EUR",
      "architecture": "x86",
      "location": "eu",
      "category": "standard"
    },
    {
      "id": "standard.titan",
      "name": "Titan",
      "vcpu": 16,
      "ram_gb": 128,
      "disk_gb": 10,
      "disk_type": "ssd",
      "price_hourly": 1.49333,
      "price_monthly": 1090.13,
      "currency": "EUR",
      "architecture": "x86",
      "location": "eu",
      "category": "standard"
    },
    {
      "id": "standard.jumbo",
      "name": "Jumbo",
      "vcpu": 24,
      "ram_gb": 225,
      "disk_gb": 10,
      "disk_type": "ssd",
      "price_hourly": 2.24,
      "price_monthly": 1635.2,
      "currency": "EUR",
      "architecture": "x86",
      "location": "eu",
      "category": "standard"
    },
    {
      "id": "storage.extra-large",
      "name": "Storage Extra-Large",
      "vcpu": 4,
      "ram_gb": 16,
      "disk_gb": 1000,
      "disk_type": "ssd",
      "price_hourly": 0.14,
      "price_monthly": 102.2,
      "currency": "EUR",
      "architecture": "x86",
      "location": "eu",
      "category": "storage"
    },
    {
      "id": "storage.huge",
      "name": "Storage Huge",
      "vcpu": 8,
      "ram_gb": 32,
      "disk_gb": 2000,
      "disk_type": "ssd",
      "price_hourly": 0.28,
      "price_monthly": 204.4,
      "currency": "EUR",
      "architecture": "x86",
      "location": "eu",
      "category": "storage"
    },
    {
      "id": "storage.mega",
      "name": "Storage Mega",
      "vcpu": 12,
      "ram_gb": 64,
      "disk_gb": 3000,
      "disk_type": "ssd",
      "price_hourly": 0.56,
      "price_monthly": 408.8,
      "currency": "EUR",
      "architecture": "x86",
      "location": "eu",
      "category": "storage"
    },
    {
      "id": "storage.titan",
      "name": "Storage Titan",
      "vcpu": 16,
      "ram_gb": 128,
      "disk_gb": 5000,
      "disk_type": "ssd",
      "price_hourly": 1.12,
      "price_monthly": 817.6,
      "currency": "EUR",
      "architecture": "x86",
      "location": "eu",
      "category": "storage"
    },
    {
      "id": "storage.jumbo",
      "name": "Storage Jumbo",
      "vcpu": 24,
      "ram_gb": 225,
      "disk_gb": 10000,
      "disk_type": "ssd",
      "price_hourly": 1.86667,
      "price_monthly": 1362.67,
      "currency": "EUR",
      "architecture": "x86",
      "location": "eu",
      "category": "storage"
    }
  ],
  "load_balancer": {
    "price_monthly": 25.35
  },
  "block_storage": {
    "price_per_gb_monthly": 0.1022
  },
  "egress": {
    "free_gb_per_instance_hour": 1.42,
    "price_per_gb": 0.02,
    "notes": "Free tier per instance, then €0.02/GB"
  },
  "object_storage": {
    "price_per_gb_monthly": 0.02008,
    "type": "SOS (Simple Object Storage)",
    "min_object_size_kb": 128,
    "notes": "Tiered pricing: €0.02/GB up to 512TiB, cheaper for larger volumes. 128KB minimum object billing."
  }
}
