{
  "provider": "thalassa",
  "fetched_at": "2026-05-20T00:00:00.000Z",
  "source": "thalassa.cloud/pricing",
  "manual": true,
  "control_plane_cost": 19.50,
  "instances": [
    {
      "id": "dgp-small",
      "name": "dgp-small",
      "vcpu": 1,
      "ram_gb": 2,
      "disk_gb": 0,
      "disk_type": "network",
      "price_hourly": 0.0072,
      "price_monthly": 5.18,
      "currency": "EUR",
      "architecture": "x86",
      "location": "eu",
      "category": "development"
    },
    {
      "id": "dgp-medium",
      "name": "dgp-medium",
      "vcpu": 2,
      "ram_gb": 4,
      "disk_gb": 0,
      "disk_type": "network",
      "price_hourly": 0.0209,
      "price_monthly": 15.11,
      "currency": "EUR",
      "architecture": "x86",
      "location": "eu",
      "category": "development"
    },
    {
      "id": "dgp-large",
      "name": "dgp-large",
      "vcpu": 2,
      "ram_gb": 8,
      "disk_gb": 0,
      "disk_type": "network",
      "price_hourly": 0.0551,
      "price_monthly": 39.27,
      "currency": "EUR",
      "architecture": "x86",
      "location": "eu",
      "category": "development"
    },
    {
      "id": "dgp-xlarge",
      "name": "dgp-xlarge",
      "vcpu": 4,
      "ram_gb": 16,
      "disk_gb": 0,
      "disk_type": "network",
      "price_hourly": 0.1236,
      "price_monthly": 89.79,
      "currency": "EUR",
      "architecture": "x86",
      "location": "eu",
      "category": "development"
    },
    {
      "id": "dgp-2xlarge",
      "name": "dgp-2xlarge",
      "vcpu": 8,
      "ram_gb": 32,
      "disk_gb": 0,
      "disk_type": "network",
      "price_hourly": 0.2606,
      "price_monthly": 189.63,
      "currency": "EUR",
      "architecture": "x86",
      "location": "eu",
      "category": "development"
    },
    {
      "id": "dgp-4xlarge",
      "name": "dgp-4xlarge",
      "vcpu": 16,
      "ram_gb": 64,
      "disk_gb": 0,
      "disk_type": "network",
      "price_hourly": 0.5346,
      "price_monthly": 388.11,
      "currency": "EUR",
      "architecture": "x86",
      "location": "eu",
      "category": "development"
    },
    {
      "id": "pgp-small",
      "name": "pgp-small",
      "vcpu": 1,
      "ram_gb": 2,
      "disk_gb": 0,
      "disk_type": "network",
      "price_hourly": 0.0113,
      "price_monthly": 8.14,
      "currency": "EUR",
      "architecture": "x86",
      "location": "eu",
      "category": "production"
    },
    {
      "id": "pgp-medium",
      "name": "pgp-medium",
      "vcpu": 2,
      "ram_gb": 4,
      "disk_gb": 0,
      "disk_type": "network",
      "price_hourly": 0.0277,
      "price_monthly": 20.00,
      "currency": "EUR",
      "architecture": "x86",
      "location": "eu",
      "category": "production"
    },
    {
      "id": "pgp-large",
      "name": "pgp-large",
      "vcpu": 2,
      "ram_gb": 8,
      "disk_gb": 0,
      "disk_type": "network",
      "price_hourly": 0.0688,
      "price_monthly": 49.54,
      "currency": "EUR",
      "architecture": "x86",
      "location": "eu",
      "category": "production"
    },
    {
      "id": "pgp-xlarge",
      "name": "pgp-xlarge",
      "vcpu": 4,
      "ram_gb": 16,
      "disk_gb": 0,
      "disk_type": "network",
      "price_hourly": 0.151,
      "price_monthly": 108.72,
      "currency": "EUR",
      "architecture": "x86",
      "location": "eu",
      "category": "production"
    },
    {
      "id": "pgp-2xlarge",
      "name": "pgp-2xlarge",
      "vcpu": 8,
      "ram_gb": 32,
      "disk_gb": 0,
      "disk_type": "network",
      "price_hourly": 0.3072,
      "price_monthly": 221.18,
      "currency": "EUR",
      "architecture": "x86",
      "location": "eu",
      "category": "production"
    },
    {
      "id": "pgp-4xlarge",
      "name": "pgp-4xlarge",
      "vcpu": 16,
      "ram_gb": 64,
      "disk_gb": 0,
      "disk_type": "network",
      "price_hourly": 0.6277,
      "price_monthly": 452.74,
      "currency": "EUR",
      "architecture": "x86",
      "location": "eu",
      "category": "production"
    }
  ],
  "block_storage": {
    "price_per_gb_monthly": 0.18,
    "price_hourly": 0.000246,
    "currency": "EUR"
  },
  "object_storage": {
    "price_per_gb_monthly": 0.05,
    "price_hourly": 0.00007,
    "currency": "EUR"
  },
  "load_balancer": {
    "price_monthly": 15.00,
    "price_hourly": 0.0206,
    "currency": "EUR",
    "type": "HA Network Load Balancer (TCP/UDP)"
  },
  "egress": {
    "free_tb": "unlimited",
    "price_per_gb": 0,
    "notes": "Data transfer free for all network types: private, cross-AZ, inbound, outbound"
  },
  "notes": "Dutch cloud provider. DGP (development) uses Intel Xeon E5, PGP (production) uses Intel Xeon Gold. Per-minute billing."
}
