{
  "provider": "cleura",
  "fetched_at": "2026-05-20T00:00:00.000Z",
  "source": "cleura.com/pricing",
  "manual": true,
  "control_plane_cost": 0,
  "instances": [
    {
      "id": "public-1-1",
      "name": "Public 1vCPU 1GB",
      "vcpu": 1,
      "ram_gb": 1,
      "disk_gb": 0,
      "disk_type": "network",
      "price_hourly": 0.0185,
      "price_monthly": 13.32,
      "currency": "EUR",
      "architecture": "x86",
      "location": "eu",
      "category": "standard"
    },
    {
      "id": "public-4-8",
      "name": "Public 4vCPU 8GB",
      "vcpu": 4,
      "ram_gb": 8,
      "disk_gb": 0,
      "disk_type": "network",
      "price_hourly": 0.1076,
      "price_monthly": 77.52,
      "currency": "EUR",
      "architecture": "x86",
      "location": "eu",
      "category": "standard"
    },
    {
      "id": "public-8-16",
      "name": "Public 8vCPU 16GB",
      "vcpu": 8,
      "ram_gb": 16,
      "disk_gb": 0,
      "disk_type": "network",
      "price_hourly": 0.2153,
      "price_monthly": 155.04,
      "currency": "EUR",
      "architecture": "x86",
      "location": "eu",
      "category": "standard"
    }
  ],
  "block_storage": {
    "price_per_gb_monthly": 0.1,
    "currency": "EUR"
  },
  "object_storage": {
    "price_per_gb_monthly": 0.02,
    "currency": "EUR",
    "notes": "Swift"
  },
  "load_balancer": {
    "price_monthly": 34.44,
    "currency": "EUR"
  },
  "primary_ip": {
    "ipv4_monthly": 4.84,
    "ipv6_monthly": 0,
    "currency": "EUR"
  },
  "egress": {
    "price_per_gb": 0.02875,
    "currency": "EUR",
    "notes": "ingress free"
  },
  "notes": "OpenStack-based cloud. All prices EUR excl. VAT. Per-unit pricing: CPU €0.01009/h, RAM €0.00841/h. Data centers in Sweden and Germany."
}
